{
    "title": "Emerging Curators Project 2019",
    "slug": "emerging-curators-project-2019",
    "newsType": {
        "title": "Announcement",
        "slug": "announcement"
    },
    "tags": [],
    "date": "2018-11-13T20:20:39+00:00",
    "blocks": [
        {
            "type": "text",
            "body": "The Emerging Curators Project, hosted by the Power Station of Art, was first launched in 2014, and has so far helped more than 20 young Chinese curators realize 14 exhibitions. Their practices at the power-plant-converted art space have not only expanded our curatorial horizons, but also allowed more young Chinese artists and their talents to be accessed and appreciated by both the audience and the international art community"
        }
    ]
}